{
  "schemaVersion": "chromalab.benchmark.evidence_package.v1",
  "caseId": "phase9j_bench_04_stacked_xic_resolution_model_enabled",
  "runId": "bench_04_stacked_xic_resolution_20260526_185209",
  "terminalState": "REVIEW",
  "runtimeFailureClass": "UNKNOWN_FAILURE",
  "artifacts": [
    {
      "artifactType": "original_image",
      "path": "composeApp/src/androidMain/assets/validation/bench_04_stacked_xic_resolution.png",
      "privacyClass": "USER_REPORT_SAFE"
    },
    {
      "artifactType": "runtime_evidence_package",
      "path": "artifacts/phase9i-final-android/bench_04_stacked_xic_resolution/model_enabled/bench_04_stacked_xic_resolution_20260526_185209/runtime_evidence_package_run_1779810825697.json",
      "privacyClass": "DIAGNOSTIC_ONLY"
    },
    {
      "artifactType": "validator_json",
      "path": "artifacts/phase9i-final-android/bench_04_stacked_xic_resolution/model_enabled/bench_04_stacked_xic_resolution_20260526_185209/runtime_evidence_validation_run_1779810825697.json",
      "privacyClass": "DIAGNOSTIC_ONLY"
    },
    {
      "artifactType": "validator_markdown",
      "path": "artifacts/phase9i-final-android/bench_04_stacked_xic_resolution/model_enabled/bench_04_stacked_xic_resolution_20260526_185209/runtime_evidence_validation_run_1779810825697.md",
      "privacyClass": "DIAGNOSTIC_ONLY"
    },
    {
      "artifactType": "final_report_json",
      "path": "artifacts/phase9i-final-android/bench_04_stacked_xic_resolution/model_enabled/bench_04_stacked_xic_resolution_20260526_185209/final_report_contract_run_1779810825697.json",
      "privacyClass": "USER_REPORT_SAFE"
    },
    {
      "artifactType": "html_report",
      "path": "artifacts/phase9i-final-android/bench_04_stacked_xic_resolution/model_enabled/bench_04_stacked_xic_resolution_20260526_185209/report_run_1779810825697.html",
      "privacyClass": "USER_REPORT_SAFE"
    },
    {
      "artifactType": "markdown_report",
      "path": "artifacts/phase9i-final-android/bench_04_stacked_xic_resolution/model_enabled/bench_04_stacked_xic_resolution_20260526_185209/report_run_1779810825697.md",
      "privacyClass": "USER_REPORT_SAFE"
    },
    {
      "artifactType": "manifest",
      "path": "artifacts/phase9i-final-android/bench_04_stacked_xic_resolution/model_enabled/bench_04_stacked_xic_resolution_20260526_185209/artifact_manifest_run_1779810825697.json",
      "privacyClass": "DIAGNOSTIC_ONLY"
    },
    {
      "artifactType": "graph_panel_overlay",
      "path": "artifacts/phase9i-final-android/bench_04_stacked_xic_resolution/model_enabled/bench_04_stacked_xic_resolution_20260526_185209/graph_2_graph_panel_overlay.png",
      "privacyClass": "DIAGNOSTIC_ONLY"
    },
    {
      "artifactType": "plot_area_overlay",
      "path": "artifacts/phase9i-final-android/bench_04_stacked_xic_resolution/model_enabled/bench_04_stacked_xic_resolution_20260526_185209/graph_2_plot_area_overlay.png",
      "privacyClass": "DIAGNOSTIC_ONLY"
    },
    {
      "artifactType": "axis_tick_overlay",
      "path": "artifacts/phase9i-final-android/bench_04_stacked_xic_resolution/model_enabled/bench_04_stacked_xic_resolution_20260526_185209/graph_2_axis_tick_overlay.png",
      "privacyClass": "DIAGNOSTIC_ONLY"
    },
    {
      "artifactType": "trace_overlay",
      "path": "artifacts/phase9i-final-android/bench_04_stacked_xic_resolution/model_enabled/bench_04_stacked_xic_resolution_20260526_185209/graph_2_trace_overlay.png",
      "privacyClass": "DIAGNOSTIC_ONLY"
    },
    {
      "artifactType": "peak_overlay",
      "path": "artifacts/phase9i-final-android/bench_04_stacked_xic_resolution/model_enabled/bench_04_stacked_xic_resolution_20260526_185209/graph_2_peak_overlay.png",
      "privacyClass": "DIAGNOSTIC_ONLY"
    }
  ],
  "missingArtifactReasons": []
}
